en,es,en_text_length,en_num_words,en_max_word_length,en_avg_word_length,en_perc_special_chars,es_text_length,es_num_words,es_max_word_length,es_avg_word_length,es_perc_special_chars
I don't even remember what the fight was about.,No recuerdo por qué fue la pelea.,47.0,9.0,8.0,4.333333333333333,0.0425531914893617,33.0,7.0,8.0,3.857142857142857,0.030303030303030304
Here are the sites of each of those that have taken place:,Estos son los sitios en que cada Congreso ha tenido lugar:,58.0,12.0,6.0,3.9166666666666665,0.017241379310344827,58.0,11.0,8.0,4.363636363636363,0.017241379310344827
I'm the man who killed Blackbeard.,Sí. Soy el hombre que mató a Barbanegra.,34.0,6.0,11.0,4.833333333333333,0.058823529411764705,40.0,8.0,11.0,4.125,0.05
Don't get smart.,No te hagas el inteligente.,16.0,3.0,6.0,4.666666666666667,0.125,27.0,5.0,12.0,4.6,0.037037037037037035
Is there an exact moment in the life of a soldier before which he is not suffering from shell-shock and after which he is?,¿Existe un límite de cuándo se padece y cuándo no?,122.0,24.0,11.0,4.125,0.01639344262295082,50.0,10.0,7.0,4.1,0.02
"Yes, Joe.","Sí, Joe.",9.0,2.0,4.0,4.0,0.2222222222222222,8.0,2.0,4.0,3.5,0.25
Why two months?,¿Por qué dos meses?,15.0,3.0,7.0,4.333333333333333,0.06666666666666667,19.0,4.0,6.0,4.0,0.05263157894736842
- We don't need the rock.,No nos hace falta.,25.0,6.0,5.0,3.3333333333333335,0.12,18.0,4.0,6.0,3.75,0.05555555555555555
I hope Umeko will forget about marrying him.,Espero que a Umeko se le pase lo de casarse con él.,44.0,8.0,8.0,4.625,0.022727272727272728,51.0,12.0,7.0,3.3333333333333335,0.0196078431372549
He has led several projects and campaigns in Switzerland and abroad.,Ha dirigido varios proyectos y campañas en Suiza y en el extranjero.,68.0,11.0,11.0,5.2727272727272725,0.014705882352941176,68.0,12.0,11.0,4.75,0.014705882352941176
Said he went off and got hitched to Liz Kelly.,Dicen que se casó con Liz Kelly.,46.0,10.0,7.0,3.7,0.021739130434782608,32.0,7.0,6.0,3.7142857142857144,0.03125
Establish a 2-block perimeter around this block.,Establezcan un perímetro de dos cuadras alrededor de esta calle.,48.0,7.0,9.0,6.0,0.041666666666666664,64.0,10.0,11.0,5.5,0.015625
"Others continue to identify as lesbian or gay and take part in lesbian/gay communities even while having long-term—even primary—heterosexual relationships, a choice accepted by some and viewed suspiciously by others in their communities.","Otros continúan identificándose como gay y lesbiana y participan en las comunidades gay y lesbiana a la vez que mantienen relaciones heterosexuales a largo plazo, incluso primarias (una opción aceptada por algunos y vista con sospecha por otras en las comunidades).",237.0,33.0,20.0,6.212121212121212,0.016877637130801686,265.0,41.0,15.0,5.487804878048781,0.01509433962264151
"We all have to bear in mind that the problems that are being faced in Yugoslavia are deep-rooted, historical problems and they are extremely difficult.",Todos nosotros tenemos que tener muy presente que los problemas con que se tiene que hacer frente en Yugoslavia tienen unas raíces históricas muy profundas y son sumamente difíciles.,151.0,25.0,12.0,5.08,0.019867549668874173,182.0,29.0,10.0,5.310344827586207,0.005494505494505495
Now there's the bastard I know and love.,Ese es el desgraciado que conozco y que amo.,40.0,8.0,7.0,4.125,0.05,44.0,9.0,11.0,4.0,0.022727272727272728
"The new EU-Africa strategy therefore needs to take this dual reality into account and support this still fragile process by means of a genuine political partnership: one that is based on unity, for it is Africa in its entirety, through the voice of the African Union, that has to be our main point of contact; on equity with an agenda that has been drawn up together and not imposed by the North, and on humility, for Europe is not the one and only partner Africa has.","La nueva Estrategia UE-África debe, por tanto, tener en cuenta esta realidad dual y apoyar este proceso, aún frágil, por medio de una asociación auténticamente política: una asociación que esté basada en la unidad, ya que es África en su totalidad, a través de la voz de la Unión Africana, la que ha de ser nuestro principal punto de contacto; en la equidad con una agenda que haya sido elaborada conjuntamente y no haya sido impuesta por el Norte, y en la humildad, ya que Europa no es el único socio que tiene África.",468.0,86.0,12.0,4.453488372093023,0.019230769230769232,519.0,94.0,14.0,4.531914893617022,0.025048169556840076
"Labor productivity rose rose by a similar percentage during this period. Meanwhile, employment kept pace with population growth.","La rosa de la productividad de trabajo se levantó por un porcentaje similar durante este período. Mientras tanto, el empleo guardó paso con el crecimiento demográfico.",128.0,18.0,12.0,6.166666666666667,0.0234375,167.0,26.0,13.0,5.461538461538462,0.017964071856287425
Cellulose?,¿Celulosa?,10.0,1.0,10.0,10.0,0.1,10.0,1.0,10.0,10.0,0.1
- Then there's the objective kind of like fascination.,Hay un tipo de fascinación objetiva.,54.0,9.0,12.0,5.111111111111111,0.05555555555555555,36.0,6.0,11.0,5.166666666666667,0.027777777777777776
"I'm used to the way the children live at Downton, but it seems odd.","Me acostumbré a cómo los niños viven en Downton, pero aún es extraño.",67.0,14.0,8.0,3.857142857142857,0.04477611940298507,69.0,13.0,10.0,4.384615384615385,0.028985507246376812
"In announcing the Year of Faith, I too wrote that “today as in the past, he (Christ) sends us through the highways of the world to proclaim his Gospel to all the peoples of the earth” (Apostolic Letter Porta Fidei, n. 7). Such proclamation, as the Servant of God Paul VI said in his Apostolic Exhortation Evangelii Nuntiandi, “is not an optional contribution for the Church. It is the duty incumbent on her by the command of the Lord Jesus, so that people can believe and be saved. This message is indeed necessary.","En la proclamación del Año de la Fe, también yo he dicho que Cristo “hoy como ayer, nos envía por los caminos del mundo para proclamar su Evangelio a todos los pueblos de la tierra” (Carta apostólica Porta fidei, 7); una proclamación que, como afirmó también el Siervo de Dios Pablo VI en su Exhortación apostólica Evangelii nuntiandi, “no constituye para la Iglesia algo de orden facultativo: está de por medio el deber que le incumbe, por mandato del Señor, con vista a que los hombres crean y se salven. Sí, este mensaje es necesario.",515.0,93.0,13.0,4.548387096774194,0.02912621359223301,537.0,95.0,12.0,4.663157894736842,0.0260707635009311
http://www.dagev.de http://www.dagev.de/,http://www.quadkelten.de http://www.quadkelten.de/,40.0,2.0,20.0,19.5,0.275,50.0,2.0,25.0,24.5,0.22
Might be nice to have a bad boy ruffle those perfect feathers.,Podría ser agradable tener a un chico malo rizando esas plumas perfectas.,62.0,12.0,9.0,4.25,0.016129032258064516,73.0,12.0,10.0,5.166666666666667,0.0136986301369863
- What's wrong with you ?,¿Qué pasa?,25.0,6.0,6.0,3.3333333333333335,0.12,10.0,2.0,5.0,4.5,0.1
Catherine. Hey!,Catherine. ¡Oye!,15.0,2.0,10.0,7.0,0.13333333333333333,16.0,2.0,10.0,7.5,0.125
I see that's not the case.,Veo que no es el caso .,26.0,6.0,6.0,3.5,0.07692307692307693,23.0,7.0,4.0,2.4285714285714284,0.043478260869565216
- Now or never!,- ¡Ahora o nunca!,15.0,4.0,6.0,3.0,0.13333333333333333,17.0,4.0,6.0,3.5,0.11764705882352941
That I declare the Olympics open!,"""Declaro las Olimpiadas inauguradas!"".",33.0,6.0,8.0,4.666666666666667,0.030303030303030304,38.0,4.0,14.0,8.75,0.10526315789473684
In many aspects there haven't been any other recordings better than the ones La Barbería made with Nuevos Medios.,"En muchos aspectos, sus grabaciones para Nuevos Medios aún no han sido superadas.",113.0,19.0,10.0,5.0,0.017699115044247787,81.0,13.0,11.0,5.3076923076923075,0.024691358024691357
It is appropriate to supplement the multilateral surveillance procedure referred to in paragraphs 3 and 4 of Article 121 TFEU with specific rules for the detection of macroeconomic imbalances as well as the prevention and correction of excessive macroeconomic imbalances within the Union.,"Conviene complementar el procedimiento de supervisión multilateral a que se refiere el artículo 121, apartados 3 y 4, del TFUE con normas específicas para la detección de los desequilibrios macroeconómicos, así como para la prevención y corrección de desequilibrios macroeconómicos excesivos dentro de la Unión.",288.0,43.0,13.0,5.72093023255814,0.003472222222222222,311.0,45.0,16.0,5.933333333333334,0.012861736334405145
The Truth and Reconciliation Commission 53 - 59 15,Comisión de la Verdad y la Reconciliación 53 - 59 16,50.0,9.0,14.0,4.666666666666667,0.02,52.0,11.0,14.0,3.8181818181818183,0.019230769230769232
"Sanctuary, Nicky.","Santuario, Nicky.",17.0,2.0,10.0,8.0,0.11764705882352941,17.0,2.0,10.0,8.0,0.11764705882352941
Not when I hold all the cards.,No cuando yo tengo todos los naipes.,30.0,7.0,6.0,3.4285714285714284,0.03333333333333333,36.0,7.0,7.0,4.285714285714286,0.027777777777777776
He's kind of worried.,Está preocupado.,21.0,4.0,8.0,4.5,0.09523809523809523,16.0,2.0,11.0,7.5,0.0625
"- I'm ready, Bob. - Do it!","- Estoy listo, Bob.",26.0,7.0,6.0,2.857142857142857,0.23076923076923078,19.0,4.0,6.0,4.0,0.15789473684210525
I think he needs a little time by himself.,Creo que necesita un poco de tiempo por a sí mismo.,42.0,9.0,8.0,3.7777777777777777,0.023809523809523808,51.0,11.0,8.0,3.727272727272727,0.0196078431372549
"We need to surgically switch faces, so I can pretend to be you and win her heart.",Tenemos que cambiar rostros quirúrgicamente para poderme hacer pasar por ti y ganarme su corazón.,81.0,17.0,10.0,3.823529411764706,0.024691358024691357,97.0,15.0,15.0,5.533333333333333,0.010309278350515464
"In a New Zealand parliamentary debate regarding the New Zealand phosphate imports from Western Sahara on July 26th 2006, you mentioned that you were indeed aware of the UN opinion from 2002, stating that the interests of the inhabitants of non-self governing territories must be paramount in such an issue when considering the legality of such imports.","En un debate parlamentario en Nueva Zelanda en relación con las importaciones de fosfatos del Sahara Occidental el 26 de Julio de 2006, mencionó que era consciente de la opinión de Naciones Unidas desde 2002, y afirmó que los intereses de los territorios no autónomos deben ser primordiales en esta cuestión al examinar la legalidad de dichas importaciones.",352.0,57.0,13.0,5.192982456140351,0.011363636363636364,357.0,58.0,14.0,5.172413793103448,0.008403361344537815
Let's change the subject...,- Pero hablemos de otra cosa.,27.0,4.0,10.0,6.0,0.14814814814814814,29.0,6.0,8.0,4.0,0.06896551724137931
You're gonna turn down a job in a real music video. Just to be in some little play here at school?,¿Vas a rechazar un trabajo de verdad solo para estar en una pequeña obra de la escuela?,98.0,21.0,7.0,3.7142857142857144,0.030612244897959183,87.0,17.0,8.0,4.176470588235294,0.011494252873563218
But how much is that really worth?,¿Pero cuánto es realmente lo que vale?,34.0,7.0,6.0,4.0,0.029411764705882353,38.0,7.0,9.0,4.571428571428571,0.02631578947368421
- You think? - Yes.,¿Tú crees?,19.0,5.0,6.0,3.0,0.21052631578947367,10.0,2.0,6.0,4.5,0.1
Go to your room and think about all the toys you've got!,¡Vete a tú habitación y piensa en toda la cantidad de juguetes que tienes!,56.0,12.0,6.0,3.75,0.03571428571428571,74.0,14.0,10.0,4.357142857142857,0.013513513513513514
- I thought this was the bathroom.,Pensé que éste era el baño.,34.0,7.0,9.0,4.0,0.058823529411764705,27.0,6.0,5.0,3.6666666666666665,0.037037037037037035
The anatomoechocardiographic correlation was precise and allowed a better understanding of this anomaly.,La correlación anatómica-ecocardiográfica fue precisa y permitió un mejor conocimiento de esta anomalía.,104.0,13.0,24.0,7.076923076923077,0.009615384615384616,104.0,13.0,26.0,7.076923076923077,0.019230769230769232
It was why I could not allow you to drown at the bottom of Reiden Lake. Why it was necessary to allow the other Dr. Bishop to cure you instead.,Por eso no pude permitir que te ahogaras en el fondo del lago Reiden por eso era necesario permitir que el otro doctor Bishop lograra curarte.,143.0,30.0,9.0,3.8,0.02097902097902098,142.0,26.0,9.0,4.5,0.007042253521126761
"I'll get the scissors, Joe!","¡Yo tomaré las tijeras, Joe!",27.0,5.0,9.0,4.6,0.1111111111111111,28.0,5.0,8.0,4.8,0.07142857142857142
"With other children, a few months ago ?","-Con otros niños, hace varios meses. ¿Qué te pasa?",39.0,8.0,9.0,4.0,0.05128205128205128,50.0,9.0,6.0,4.666666666666667,0.08
"Unlike modern mainstream Moroccan art, which is under pressure to conform to certain standards, independent art in Darija pushes boundaries, using profanity and slang, touching on highly controversial themes, and experimenting with different styles.","De manera contraria al arte marroquí moderno mayoritario, bajo la presión de ajustarse a ciertos estándares, el arte independiente en darija rompe fronteras con blasfemias y jerga, se centra en temas muy polémicos y experimenta con estilos distintos.",249.0,34.0,13.0,6.352941176470588,0.024096385542168676,250.0,38.0,13.0,5.605263157894737,0.016
The nurse may direct you to other care. Or the nurse may help you over the phone.,Tenga a la mano su número de tarjeta de identificación de Peach State. El(la) enfermero(a) lo(a) puede dirigir a otro tipo de atención médica. O puede ayudarle por teléfono.,81.0,17.0,6.0,3.823529411764706,0.024691358024691357,173.0,29.0,14.0,5.0,0.05202312138728324
Really?,¿En serio?,7.0,1.0,7.0,7.0,0.14285714285714285,10.0,2.0,6.0,4.5,0.1
"Where was that, in Florence?","¿Dónde fué eso, en Florencia?",28.0,5.0,9.0,4.8,0.07142857142857142,29.0,5.0,10.0,5.0,0.06896551724137931
- I'll call this now.,- Ahora mismo les aviso.,21.0,5.0,4.0,3.4,0.14285714285714285,24.0,5.0,6.0,4.0,0.08333333333333333
well actually that was the conference at Copenhagen,"Bueno, de hecho fue en la conferencia de Copenhague.",51.0,8.0,10.0,5.5,0.0,52.0,9.0,11.0,4.888888888888889,0.038461538461538464
"I can still see you as a baby, sucking on your mother's tit, with fierce determination.","Todavía te puedo ver como un bebé, pegado de la teta de tu mamá, con determinación.",87.0,16.0,14.0,4.5,0.04597701149425287,83.0,16.0,14.0,4.25,0.03614457831325301
"I know I've been on your case, but the truth is, you made this all happen.","Sé que he estado sobre tu caso, pero la verdad es que has hecho que todo esto sea posible.",74.0,16.0,7.0,3.6875,0.05405405405405406,90.0,19.0,8.0,3.789473684210526,0.022222222222222223
You'll see that we belong together.,Verás que somos el uno para el otro.,35.0,6.0,9.0,5.0,0.05714285714285714,36.0,8.0,5.0,3.625,0.027777777777777776
The origins of cremation cannot be traced back in the history of Mankind. Ancient civilizations performed it respecting their own customs and beliefs.,Se pierde en las páginas del tiempo de la Humanidad el origen de la cremación. Las antiguas civilizaciones la realizaban respetando sus respectivas costumbres y creencias.,150.0,23.0,13.0,5.565217391304348,0.013333333333333334,171.0,26.0,14.0,5.615384615384615,0.011695906432748537
Mine's vodka.,Mi excusa es el vodka.,13.0,2.0,6.0,6.0,0.15384615384615385,22.0,5.0,6.0,3.6,0.045454545454545456
Tonight we're offering you one of Patrick Godureaux's favorite pieces:,Esta noche los estamos ofreciendo una de Piezas favoritas de Patrick Godureaux :,70.0,10.0,11.0,6.1,0.04285714285714286,80.0,13.0,10.0,5.230769230769231,0.0125
"In keeping with our editorial policies, we reserve the right to excise comments that we deem inappropriate, but all civil voices will be heard, all opinions respected.","Manteniendo nuestra política editorial, nos reservamos el derecho a eliminar comentarios que consideremos inapropiados, pero todas las voces civiles serán escuchadas y todas las opiniones, respetadas.",167.0,27.0,14.0,5.222222222222222,0.023952095808383235,200.0,26.0,13.0,6.730769230769231,0.02
I am still travelling and hope to reach a destination sometime!,¡Yo sigo viajando y espero llegar a un destino alguna vez!,63.0,11.0,11.0,4.818181818181818,0.015873015873015872,58.0,11.0,8.0,4.363636363636363,0.017241379310344827
RummschuetteI will have to be paid if he remains our doctor.,Hay que añadir los honorarios del Sr. Rummschüttel.,60.0,11.0,13.0,4.545454545454546,0.016666666666666666,51.0,8.0,13.0,5.5,0.0392156862745098
What did NASA image and why is this image being withheld from public view?,"Qué mostraba la imagen de NASA, y por qué esta imagen fue retenida de la mirada pública?",74.0,14.0,8.0,4.357142857142857,0.013513513513513514,88.0,17.0,8.0,4.235294117647059,0.022727272727272728
The Council is meeting in accordance with the understanding reached in the course of its prior consultations.,El Consejo de Seguridad se reúne de conformidad con el entendimiento alcanzado en sus consultas previas.,109.0,17.0,14.0,5.470588235294118,0.009174311926605505,104.0,16.0,13.0,5.5625,0.009615384615384616
This is Lennox.,Habla Lennox.,15.0,3.0,7.0,4.333333333333333,0.06666666666666667,13.0,2.0,7.0,6.0,0.07692307692307693
"Yes, you said that, ma'am.","Sí, usted ha dicho que, ma apos; am.",26.0,5.0,6.0,4.4,0.15384615384615385,36.0,8.0,5.0,3.625,0.1111111111111111
"The ladder from your country is not going up; it is going down."" - Our Lady, December 7, 1971","La escalera de vuestra nación no va hacia arriba; va hacia abajo. - Nuestra Señora, 7 de Diciembre, 1971",93.0,19.0,8.0,3.9473684210526314,0.06451612903225806,104.0,19.0,10.0,4.526315789473684,0.04807692307692308
The Board assessed the extent to which the financial statements conformed to the United Nations system accounting standards.,La Junta consideró hasta qué punto los estados financieros se ajustaban a las normas contables del sistema de las Naciones Unidas.,124.0,18.0,10.0,5.944444444444445,0.008064516129032258,130.0,21.0,11.0,5.238095238095238,0.007692307692307693
http://theeworld.blogspot.com.es/,http://theeworld.blogspot.com.es/,33.0,1.0,33.0,33.0,0.21212121212121213,33.0,1.0,33.0,33.0,0.21212121212121213
"H 12 Waste which releases toxic or very toxic gases in contact with water, air or an acid.","H 12 Residuos que emiten gases tóxicos o muy tóxicos al entrar en contacto con el aire, con el agua o con un ácido.",90.0,18.0,8.0,4.055555555555555,0.022222222222222223,115.0,24.0,8.0,3.8333333333333335,0.017391304347826087
What of a stamp of quality for foodstuffs free from genetic modification?,¿Qué me dice del sello calidad para los alimentos no manipulados genéticamente?,73.0,12.0,13.0,5.166666666666667,0.0136986301369863,79.0,12.0,14.0,5.666666666666667,0.012658227848101266
"It's a polyester and polyolefin blend, like what you'd find in the trunk of a car.","Es una mezcla de poliéster y poliolefina, como el que encuentras en el maletero de un auto.",82.0,16.0,10.0,4.1875,0.04878048780487805,91.0,17.0,12.0,4.411764705882353,0.02197802197802198
"Okay, what, what, what are you thinking?","Bien, ¿qué, qué, qué estás pensando?",40.0,7.0,9.0,4.857142857142857,0.1,36.0,6.0,9.0,5.166666666666667,0.1111111111111111
Mens wristwatch (2),Dorada (2) Correa,19.0,3.0,10.0,5.666666666666667,0.10526315789473684,17.0,3.0,6.0,5.0,0.11764705882352941
- He doesn't want to be interrupted.,Todavía está con Richard.,36.0,7.0,12.0,4.285714285714286,0.08333333333333333,25.0,4.0,8.0,5.5,0.04
Larry you can't keep on carrying a secret like that.,"Larry, ...no puedes algo así en secreto.",52.0,10.0,8.0,4.3,0.038461538461538464,40.0,7.0,8.0,4.857142857142857,0.125
Until I realized it was just a dream.,Hasta que entendí que no era más que un sueño.,37.0,8.0,8.0,3.75,0.02702702702702703,46.0,10.0,7.0,3.7,0.021739130434782608
This makes a total of 192 orphaned packages.,Esto da un total de 132 paquetes huérfanos.,44.0,8.0,9.0,4.625,0.022727272727272728,43.0,8.0,10.0,4.5,0.023255813953488372
"Each chapter of the saga revolves around one specific meteorite, of the many buried, lost or still to be discovered in the chaqueño soil.","Cada capítulo de la saga gira en torno de un meteorito específico, de los muchos desenterrados, perdidos o todavía por descubrir en el suelo chaqueño.",137.0,24.0,10.0,4.75,0.021897810218978103,150.0,25.0,14.0,5.04,0.02
Whoa! That was crazy fast.,- Eso sí que fue rápido.,26.0,5.0,5.0,4.4,0.07692307692307693,24.0,6.0,7.0,3.1666666666666665,0.08333333333333333
Have you heard the rustling of the leaves.,Ha escuchado el crujir de las hojas.,42.0,8.0,8.0,4.375,0.023809523809523808,36.0,7.0,9.0,4.285714285714286,0.027777777777777776
I only have this one shot.,solo tengo un disparo.,26.0,6.0,5.0,3.5,0.038461538461538464,22.0,4.0,8.0,4.75,0.045454545454545456
"She's, uh, she's here for a different reason. It doesn't matter.",Ella está aquí por una razón diferente.,64.0,11.0,9.0,4.909090909090909,0.109375,39.0,7.0,10.0,4.714285714285714,0.02564102564102564
Sometimes I think grad school's just a weird psychological experiment.,A veces pienso que la escuela de postgrado es un extraño experimento sicológico,70.0,10.0,13.0,6.1,0.02857142857142857,79.0,13.0,11.0,5.153846153846154,0.0
He works nearby.,Trabaja aquí al lado.,16.0,3.0,7.0,4.666666666666667,0.0625,21.0,4.0,7.0,4.5,0.047619047619047616
"Well... well,well,well,well,well.","¡Vaya! Bien. Bien, bien, bien, bien...",33.0,2.0,25.0,16.0,0.24242424242424243,38.0,6.0,7.0,5.5,0.21052631578947367
Undertakings by Participants,Compromisos de los participantes,28.0,3.0,12.0,8.666666666666666,0.0,32.0,4.0,13.0,7.25,0.0
- Won't you have something?,- ¿No te tomarás nada?,27.0,5.0,10.0,4.6,0.1111111111111111,22.0,5.0,7.0,3.6,0.09090909090909091
Let me -- No!,Permíteme... - ¡No!,13.0,4.0,3.0,2.5,0.23076923076923078,19.0,3.0,12.0,5.666666666666667,0.2631578947368421
It was just some stupid... fairy-tale rave.,Sólo fue una estúpida... fiesta de cuentos de hadas.,43.0,7.0,10.0,5.285714285714286,0.11627906976744186,52.0,9.0,11.0,4.888888888888889,0.07692307692307693
Very well. If you say so.,"Muy bien, si Ud. Io dice...",25.0,6.0,5.0,3.3333333333333335,0.08,27.0,6.0,7.0,3.6666666666666665,0.18518518518518517
Need some medical attention or something?,¿Necesitas atención médica o algo?,41.0,6.0,10.0,6.0,0.024390243902439025,34.0,5.0,10.0,6.0,0.029411764705882353
"And now he's dead, so I'm stuck with my vow.","Y ya falleció, por lo que debo seguir cumpliéndolo.",44.0,10.0,5.0,3.5,0.09090909090909091,51.0,9.0,13.0,4.777777777777778,0.0392156862745098
"According to studies, the paintings go back to the Magdalenian period, and thus they are over 13.000 years old. They were made using black ink .","Según los estudios, los dibujos pertenecen al periodo Magdaleniense y, por tanto, tienen más de 13.000 años . Están hechos con tinta negra.",144.0,26.0,11.0,4.576923076923077,0.034722222222222224,139.0,23.0,13.0,5.086956521739131,0.04316546762589928
That' s a level- eight security door.,Son puertas del nivel de seguridad 8.,37.0,7.0,8.0,4.428571428571429,0.08108108108108109,37.0,7.0,9.0,4.428571428571429,0.02702702702702703
About anything at all.,O acerca de algo en absoluto.,22.0,4.0,8.0,4.75,0.045454545454545456,29.0,6.0,9.0,4.0,0.034482758620689655
Klaus saved my life.,Klaus me salvó la vida.,20.0,4.0,5.0,4.25,0.05,23.0,5.0,5.0,3.8,0.043478260869565216
"It was the bridge constituted by the very souls –a bridge that one day should be tended between the beyond and this earth, between known and unknown.","Era el puente constituido por las mismas almas, el puente que un día tendría que estar tendido entre el más allá y esta tierra, entre lo conocido y lo desconocido.",149.0,27.0,11.0,4.555555555555555,0.013422818791946308,163.0,30.0,12.0,4.466666666666667,0.018404907975460124
"The Sonata in F for Violin and Keyboard, K. 547, was completed on July 10, 1788 by Wolfgang Amadeus Mozart.","La Sonata para violín n.º 36 en fa mayor, K. 547, fue completada el 10 de julio de 1788 por Wolfgang Amadeus Mozart.",107.0,20.0,9.0,4.4,0.04672897196261682,116.0,23.0,10.0,4.086956521739131,0.04310344827586207
"As for the objective of participating in the Middle East peace process, how can we fail to have doubts when we learn that the day before yesterday, Great Britain participated unilaterally, together with the United States of America, in an air strike - yet another - against Iraq, the very day on which the inspectors stipulated in Resolution 1441 arrived there?","En cuanto al objetivo de participación en el proceso de paz de Oriente Próximo, ¿cómo no podemos tener dudas al enterarnos de que antes de ayer Gran Bretaña participó unilateralmente, junto con los Estados Unidos, en una huelga aérea, otra, contra Iraq, el mismo día en que llegaron allí los inspectores establecidos en la Resolución 1 441 l?",361.0,61.0,13.0,4.934426229508197,0.0221606648199446,342.0,58.0,16.0,4.913793103448276,0.02046783625730994
I'm going to go to Liverpool and discover The Beatles.,Voy a ir a Liverpool y descubrir a Los Beatles.,54.0,10.0,9.0,4.5,0.037037037037037035,47.0,10.0,9.0,3.8,0.02127659574468085
♪ I'm gonna make you scream ooh!,# ¡Te haré gritar! #,32.0,7.0,6.0,3.7142857142857144,0.0625,20.0,5.0,7.0,3.2,0.15
You can only keep us from our work.,Sólo nos interrumpirá nuestro trabajo.,35.0,8.0,5.0,3.5,0.02857142857142857,38.0,5.0,12.0,6.8,0.02631578947368421
"Madam, what's wrong?","¿Qué pasa, señora?",20.0,3.0,6.0,6.0,0.15,18.0,3.0,7.0,5.333333333333333,0.1111111111111111
"Let's go, Big.","Vamos, Gordo.",14.0,3.0,5.0,4.0,0.21428571428571427,13.0,2.0,6.0,6.0,0.15384615384615385
"You know, you've... been weird ever since we got back.","Sabes, has... estado raro desde que volvimos.",54.0,10.0,9.0,4.5,0.1111111111111111,45.0,7.0,9.0,5.571428571428571,0.1111111111111111
