en,es,en_text_length,en_num_words,en_max_word_length,en_avg_word_length,en_perc_special_chars,es_text_length,es_num_words,es_max_word_length,es_avg_word_length,es_perc_special_chars
"The U.S. is now planning a new ""security architecture"" in the Persian Gulf, includingan integrated ""air and naval defense,"" that is, the feudal states will get more U.S. and NATO-compatible military equipment -- one can see the planned delivery of 200 Leopard tanks to Saudi Arabia -- and are directly integrated into the Western military structures.","En EE.UU. se planea una nueva “arquitectura de la seguridad” en el Golfo Pérsico que, entre otras cosas, incluye una “defensa aérea y marítima” integrada. Esto significa que los estados feudales han de recibir más equipamiento bélico compatible con el EE.UU. y la OTAN –véase la prevista entrega de 200 tanques Leopard a Arabia Saudí– e incorporarse directamente a las estructuras militares occidentales.",350.0,56.0,15.0,5.267857142857143,0.04857142857142857,404.0,63.0,13.0,5.428571428571429,0.019801980198019802
Ref: 806,Ref: 1945,8.0,2.0,4.0,3.5,0.125,9.0,2.0,4.0,4.0,0.1111111111111111
"If he's a pro, no one knows he's here.","Si el es un profesional, nadie va a sabe que está aquí.",38.0,9.0,5.0,3.3333333333333335,0.10526315789473684,55.0,12.0,12.0,3.6666666666666665,0.03636363636363636
"In regard to Amendment No 3 and the second paragraph of Amendment No 11, the Commission considers the proposed amendments to be of no use, and consequently unacceptable.","Las enmiendas n2 4, n2 5 y n2 9 aumentarían las cargas económicas de la industria sin incrementar de un modo claro la protección de la salud humana o del medio ambiente.",169.0,28.0,13.0,5.071428571428571,0.01775147928994083,169.0,32.0,11.0,4.3125,0.011834319526627219
"♪ Take my mind, and take my pain ♪",♪ Llévate mi mente y llévate mi dolor ♪,34.0,9.0,5.0,2.888888888888889,0.029411764705882353,39.0,9.0,7.0,3.4444444444444446,0.0
"The Committee expresses concern at the lack of express and comprehensive legal provisions prohibiting discrimination against women, and at the State party's preference for gender-neutral [laws], policies and programmes, which may lead to inadequate protection for women against direct as well as indirect discrimination, hinder the achievement of formal and substantive equality between women and men, and result in a fragmented approach to the recognition and enforcement of women's human rights.","El Comité observa con preocupación que no hay de disposiciones legales expresas y completas que prohíban la discriminación contra la mujer y que el Estado parte prefiere las leyes, políticas y programas neutrales en materia de género, que pueden redundar en una protección insuficiente de la mujer contra la discriminación directa e indirecta, obstaculizar el logro de la igualdad formal y sustantiva entre mujeres y hombres y favorecer un enfoque fragmentario en lo que respecta a reconocer y garantizar el ejercicio de los derechos humanos de la mujer.",497.0,71.0,15.0,6.014084507042254,0.022132796780684104,554.0,88.0,14.0,5.306818181818182,0.007220216606498195
The consequence of this extensive liability has been that access providers have taken steps to protect themselves.,La consecuencia de aumentar esta responsabilidad ha sido que los proveedores de acceso han tomado varias medidas para protegerse.,114.0,17.0,11.0,5.764705882352941,0.008771929824561403,129.0,19.0,15.0,5.842105263157895,0.007751937984496124
You looked so sweet struggling with the... ..wheels on that little case.,Parecías tan dulce luchando con las ruedas en aquel caso.,72.0,12.0,10.0,5.083333333333333,0.08333333333333333,57.0,10.0,8.0,4.8,0.017543859649122806
"I would also like to take this opportunity to thank Mr Semneby sincerely, as he represents the Council and is also very active in this region.","También quiero aprovechar esta oportunidad para expresar mi más sincero agradecimiento al señor Semneby, puesto que representa al Consejo, y también es un miembro muy activo en esta región.",142.0,26.0,11.0,4.5,0.014084507042253521,189.0,29.0,14.0,5.551724137931035,0.015873015873015872
You want me to go in there and just be a robot?,- ¡Eso es lo que me pasa! - Estudio. ¡¿Quieres que vaya ahí y sea solo un robot?,47.0,12.0,6.0,3.0,0.02127659574468085,80.0,18.0,9.0,3.5,0.0625
"If it is not highlyimprobable that hazardous explosiveatmospheres and effective sources of ignition will occur simul-taneously,explosion mitigation measures must also be taken as described in Section 3.3 in conjunction with organisational measures as described in Section 4.Otherwise proportionate mitigation measures must be taken.","Cuando no sea posible excluir por entero la formación de atmósferas explosivas peligrosas,deberán adoptarse medidas para evitar las fuentes de ignición efectivas.Así pues,cuanto más probable sea la aparición de una atmósfera explosiva peligrosa,tanto más segura deberá ser la prevención de fuentes ignición efectivas.Las medidas de protección posibles se describen en el apartado 3.2,unidas a las medidas organizativas conforme al capítulo 4.",332.0,43.0,25.0,6.744186046511628,0.015060240963855422,442.0,61.0,18.0,6.262295081967213,0.01809954751131222
"Under the Arms and Explosives Act 2000, any person who wishes to import firearms has to apply for permit from the Royal Brunei Police Force.","Con arreglo a lo dispuesto en la Ley de armas y explosivos de 2000, toda persona que desee importar armas de fuego deberá solicitar un permiso de la Real Fuerza de Policía de Brunei.",140.0,25.0,10.0,4.64,0.014285714285714285,182.0,34.0,10.0,4.382352941176471,0.01098901098901099
Need to present a person to the police; Having no fixed abode; Failure to establish a person's identity; When there is “other evidence”.,- La necesidad de presentar a una persona ante la policía;,136.0,23.0,10.0,4.956521739130435,0.03676470588235294,58.0,11.0,9.0,4.363636363636363,0.034482758620689655
"No, you should stay.",Deberías quedarte.,20.0,4.0,6.0,4.25,0.1,18.0,2.0,9.0,8.5,0.05555555555555555
There's the wheelchair race of gloom and doom starring Boots Potter...,Hay la carrera de silla de ruedas de la tristeza y la fatalidad protagonizada Botas Potter...,70.0,11.0,10.0,5.454545454545454,0.05714285714285714,93.0,16.0,13.0,4.875,0.03225806451612903
The opposite qualities are being manifested by the fallen entities so as to maintain the climate that they made him create in order to exist as they wanted when they refused to re-enter Omneity.,Las cualidades opuestas son manifestadas por las entidades caídas para mantener el clima que le hicieron crear con el objeto de existir como ellos quisieron cuando rehusaron reentrar en la Totalidad.,194.0,34.0,10.0,4.735294117647059,0.010309278350515464,199.0,31.0,12.0,5.451612903225806,0.005025125628140704
"How does the ""sun21"" find its way?","¿Cómo encuentra el ""sun21"" el camino?",34.0,7.0,7.0,4.0,0.08823529411764706,37.0,6.0,9.0,5.333333333333333,0.08108108108108109
- They look easy enough to me.,- Se ven bastante fritos.,30.0,7.0,6.0,3.4285714285714284,0.06666666666666667,25.0,5.0,8.0,4.2,0.08
Let's find a quiet place to talk,Hallemos un lugar callado para hablar,32.0,7.0,5.0,3.7142857142857144,0.03125,37.0,6.0,8.0,5.333333333333333,0.0
"-[Cowboy] Amen, - ´Course, there´s some other states scattered around.",- [ Cowboy ] Amén. - Por supuesto que hay algunos otros Estados.,70.0,10.0,9.0,6.1,0.1,64.0,13.0,8.0,4.0,0.09375
Of damage in communications,en comunicaciones y navegacion de satelites.,27.0,4.0,14.0,6.0,0.0,44.0,6.0,14.0,6.5,0.022727272727272728
"Well, I'm dead and so far I've seen a lot of things but some cockamamie white light ain't one of them.","Bueno, estoy muerto y hasta ahora he visto muchas cosas pero ninguna de ellas es una tonta luz blanca.",102.0,21.0,10.0,3.9047619047619047,0.049019607843137254,102.0,19.0,7.0,4.421052631578948,0.0196078431372549
"Baby, it was in my...","Bebé, estaba en mi...",21.0,5.0,5.0,3.4,0.19047619047619047,21.0,4.0,6.0,4.5,0.19047619047619047
Pay the bill for dance classes.,Pagar las facturas de la escuela de danza.,31.0,6.0,8.0,4.333333333333333,0.03225806451612903,42.0,8.0,8.0,4.375,0.023809523809523808
They got to me.,Me convencieron.,15.0,4.0,4.0,3.0,0.06666666666666667,16.0,2.0,13.0,7.5,0.0625
"During the summer months, the snow penguins water source.","Durante los meses de verano, la nieve es la fuente de agua de migración de Pingüinos",57.0,9.0,8.0,5.444444444444445,0.03508771929824561,84.0,16.0,9.0,4.3125,0.011904761904761904
"It's just, being at a wedding tonight reminded me that Becca's getting engaged and...",Es solo que estar esta noche en una boda me recordó que Becca se ha prometido y...,85.0,14.0,8.0,5.142857142857143,0.07058823529411765,82.0,17.0,9.0,3.8823529411764706,0.036585365853658534
How have we not been caught at this point?,¿Cómo hemos llegado a este punto?,42.0,9.0,6.0,3.7777777777777777,0.023809523809523808,33.0,6.0,7.0,4.666666666666667,0.030303030303030304
- Now seal it.,"- Ahora, hazlo.",14.0,4.0,4.0,2.75,0.14285714285714285,15.0,3.0,6.0,4.333333333333333,0.2
I'd say James is sufficiently concerned about his stalker.,Yo diría que James está suficientemente preocupado por este acosador.,58.0,9.0,12.0,5.555555555555555,0.034482758620689655,69.0,10.0,15.0,6.0,0.014492753623188406
"At our company, the German Telemedia Act (TMG) and the German Federal Data Protection Act (BDSG) or other applicable legal provisions apply to any and all personal data transmitted to us.","En lo que respecta a todos los datos personales facilitados, en nuestra empresa se aplica la ley alemana de servicios de telecomunicación (TMG), de manera complementaria la ley federal de protección de datos (BDSG) u otras disposiciones legales vigentes.",187.0,31.0,11.0,5.064516129032258,0.03208556149732621,254.0,39.0,16.0,5.538461538461538,0.027559055118110236
Cross-connecting that many units will be tricky.,Conectar las unidades no será fácil.,48.0,7.0,16.0,6.0,0.041666666666666664,36.0,6.0,8.0,5.166666666666667,0.027777777777777776
Don't you know it's immoral to kiss another's girl friend.,¿No sabes que es inmoral dar un beso a una amiga.,58.0,10.0,9.0,4.9,0.06896551724137931,49.0,11.0,7.0,3.5454545454545454,0.02040816326530612
Derives from the way of the ninja.,Actúan como un ninja.,34.0,7.0,7.0,4.0,0.029411764705882353,21.0,4.0,6.0,4.5,0.047619047619047616
"Yes, and as I've told you 100 times, he got his MD at Yale.","Sí, y te dije unas 100 veces que se graduó en Yale.",59.0,14.0,6.0,3.2857142857142856,0.06779661016949153,51.0,12.0,6.0,3.3333333333333335,0.0392156862745098
He's struggling not to look at me.,Él está luchando para no mirarme.,34.0,7.0,10.0,4.0,0.058823529411764705,33.0,6.0,8.0,4.666666666666667,0.030303030303030304
"- No, it's not time.","- No, aún no.",20.0,5.0,5.0,3.2,0.2,13.0,4.0,3.0,2.5,0.23076923076923078
"Man, it's a piece of cake, all right?","Es muy fácil, Está bien?",37.0,8.0,6.0,3.75,0.10810810810810811,24.0,5.0,6.0,4.0,0.08333333333333333
"Firstly, we want the Commission to state here that there will be a framework directive on food and to tell us what the timetable for that directive would be.","En primer lugar, queremos que la Comisión declare aquí que habrá una directiva marco sobre alimentación, y que nos diga cuál será el calendario de esa directiva.",157.0,29.0,10.0,4.448275862068965,0.012738853503184714,161.0,27.0,13.0,5.0,0.018633540372670808
No! I'm going to see Polar Bears!,"No, me voy a ver osos polares.",33.0,7.0,6.0,3.857142857142857,0.09090909090909091,30.0,7.0,8.0,3.4285714285714284,0.06666666666666667
You must prove the problem for and to get complete mark. (Better results leads to additional mark.),Tiene que probar que el problema para y Para obtener la marca completa. (Mejores resultados conduce a la marca adicional.),99.0,17.0,10.0,4.882352941176471,0.04040404040404041,122.0,20.0,11.0,5.15,0.03278688524590164
- it to go this way and this way.,- que ser así y así.,33.0,9.0,4.0,2.7777777777777777,0.06060606060606061,20.0,6.0,4.0,2.5,0.1
'Silk socks.,¿El traje?,12.0,2.0,6.0,5.5,0.16666666666666666,10.0,2.0,6.0,4.5,0.1
Let's carry the walls down.,Llevemos las paredes abajo.,27.0,5.0,5.0,4.6,0.07407407407407407,27.0,4.0,8.0,6.0,0.037037037037037035
Anything from CIB then?,¿Nada del CIB entonces?,23.0,4.0,8.0,5.0,0.043478260869565216,23.0,4.0,9.0,5.0,0.043478260869565216
Yeah. Quite a view.,"Si, magnífica vista.",19.0,4.0,5.0,4.0,0.10526315789473684,20.0,3.0,9.0,6.0,0.1
"In UNDP, in response to the 2005 evaluation of gender mainstreaming issued in 2006, initiatives have been taken to upgrade accountability for gender equality results as part of a gender action plan for 2006-2007.","En el PNUD, en respuesta a la evaluación de la integración de la perspectiva de género realizada en 2005 y publicada en 2006, se han adoptado iniciativas para mejorar la rendición de cuentas en relación con los resultados en materia de igualdad entre los géneros como parte del plan de acción en materia de género para el bienio 2006-2007.",212.0,34.0,14.0,5.264705882352941,0.018867924528301886,339.0,59.0,11.0,4.762711864406779,0.011799410029498525
"Excuse us, could you wait another day?","Discúlpenos, ¿podría esperar otro día?",38.0,7.0,7.0,4.571428571428571,0.05263157894736842,38.0,5.0,12.0,6.8,0.05263157894736842
There's no use getting upset.,Es inútil tomársela.,29.0,5.0,7.0,5.0,0.06896551724137931,20.0,3.0,10.0,6.0,0.05
"You may be king, but I don't love you any more than before.","Quizá ahora seas rey, pero no te amo más que antes.",59.0,13.0,7.0,3.6153846153846154,0.05084745762711865,51.0,11.0,6.0,3.727272727272727,0.0392156862745098
The law says so.,"Porque hay leyes, hombre.",16.0,4.0,4.0,3.25,0.0625,25.0,4.0,7.0,5.5,0.08
"Femur articulation patella, tibia, fibula all appear normal.","Articulación de fémur rótula, tibia, peroné, todo parece normal.",60.0,8.0,12.0,6.625,0.05,64.0,9.0,12.0,6.222222222222222,0.0625
"You had a lot of black musicians playing with a lot of white musicians, and we all got a different way of playing, but it blends so well together.","Tienes muchos músicos de color tocando con músicos blancos, y lo que tenemos es un modo distinto de interpretar, que se mezcla fantásticamente.",146.0,29.0,10.0,4.068965517241379,0.02054794520547945,143.0,23.0,16.0,5.260869565217392,0.02097902097902098
"But once here, the honey creepers made the most of it, evolving into a variety of birds with some very distinctive bills.","Pero una vez aquí, estas avecillas sacaron todo el provecho posible, evolucionando hacia una variedad de aves con picos muy diferentes.",121.0,22.0,11.0,4.545454545454546,0.024793388429752067,135.0,21.0,13.0,5.476190476190476,0.022222222222222223
56 Henry.,Henry 56.,9.0,2.0,6.0,4.0,0.1111111111111111,9.0,2.0,5.0,4.0,0.1111111111111111
You damn bastard!,¡Maldito bastardo!,17.0,3.0,8.0,5.0,0.058823529411764705,18.0,2.0,9.0,8.5,0.05555555555555555
Could you also be wrong about the defendants?,¿Podría equivocarse también respecto a los acusados?,45.0,8.0,11.0,4.75,0.022222222222222223,52.0,7.0,11.0,6.571428571428571,0.019230769230769232
电话号码 You must be at least a Silver member to view this data,Teléfono Usted debe ser al menos Miembro Silver para ver esta información,59.0,13.0,6.0,3.6153846153846154,0.0,73.0,12.0,11.0,5.166666666666667,0.0
- 23 Squadron!,- El 23º Escuadrón.,14.0,3.0,9.0,4.0,0.14285714285714285,19.0,4.0,10.0,4.0,0.10526315789473684
There's this mate of mine.,Ese amigo mío.,26.0,5.0,7.0,4.4,0.07692307692307693,14.0,3.0,5.0,4.0,0.07142857142857142
"The representative of Iran, speaking on behalf of the Asian Group and China, noted that, in spite of the projected slowdown of growth in Asian developing countries in 2005 and 2006, Asia would remain the most dynamic region.","El representante del Irán, hablando en nombre del Grupo Asiático y China, observó que, a pesar de la desaceleración prevista del crecimiento en los países en desarrollo de Asia en 2005 y 2006, ese continente seguiría siendo la región más dinámica.",224.0,38.0,14.0,4.921052631578948,0.022321428571428572,247.0,41.0,14.0,5.048780487804878,0.020242914979757085
"The use of medicinal products called amantadine (for the treatment of Parkinson´s disease), ketamine (a substance generally used as an anaesthetic), dextromethorphan (generally used to treat cough) and other NMDA-antagonists at the same time should be avoided.","Se debe evitar el uso de memantina junto con otros medicamentos como amantadina (para el tratamiento del Parkinson), ketamina (fármaco generalmente usado para inducir la anestesia), dextrometorfano (fármaco para tratar la tos) y otros antagonistas del NMDA.",260.0,37.0,16.0,6.054054054054054,0.038461538461538464,257.0,37.0,15.0,5.972972972972973,0.03501945525291829
"This is police business, I know.","Este es un asunto policial, lo sé.",32.0,6.0,9.0,4.5,0.0625,34.0,7.0,9.0,4.0,0.058823529411764705
I'll promote....,Sólo promocionaré...,16.0,2.0,11.0,7.5,0.3125,20.0,2.0,15.0,9.5,0.15
Addison asked for coffee.,Addison pidió café.,25.0,4.0,7.0,5.5,0.04,19.0,3.0,7.0,5.666666666666667,0.05263157894736842
Dark SUV southbound through the alley.,"Camioneta oscura, por el callejón.",38.0,6.0,10.0,5.5,0.02631578947368421,34.0,5.0,9.0,6.0,0.058823529411764705
"Well, I can see why you wouldn't want that.","Bueno, puedo ver por qué usted no quiere eso.",43.0,9.0,8.0,3.888888888888889,0.06976744186046512,45.0,9.0,6.0,4.111111111111111,0.044444444444444446
"Lebanon is occupied by Syria, which has set up a puppet government - the government of the multi-millionaire Ariri, the former friend and financier of Jacques Chirac, whose inane comments and promises to the Lebanese people can now be seen for what they are.","El Líbano está ocupado por Siria que ha puesto un gobierno fantoche, el del multimillonario Ariri, amigo y financiero de Jacques Chirac, no hace mucho, de quien podemos medir hoy la inanidad de las palabras y promesas que hizo a los libaneses.",258.0,44.0,17.0,4.886363636363637,0.023255813953488372,243.0,42.0,15.0,4.809523809523809,0.0205761316872428
The work of the Office is being performed by the representative designated by the former members of the Committee and his or her designees.,La labor de la Oficina la lleva a cabo el representante designado por los ex miembros del Comité y las personas que éste ha designado.,139.0,24.0,14.0,4.833333333333333,0.007194244604316547,134.0,25.0,13.0,4.4,0.007462686567164179
Becoming aware of this is true knowledge,Volverse consciente de esto es verdadero conocimiento.,40.0,7.0,9.0,4.857142857142857,0.0,54.0,7.0,13.0,6.857142857142857,0.018518518518518517
"""Come on Sophie, not at my age!"" Put yourself down. Works every time.","""Pero, Sophie, a mi edad !"" infravalórate. siempre funciona.",69.0,13.0,8.0,4.384615384615385,0.08695652173913043,60.0,9.0,14.0,5.777777777777778,0.11666666666666667
I'm just shy.,- Símplemente soy tímido.,13.0,3.0,4.0,3.6666666666666665,0.15384615384615385,25.0,4.0,11.0,5.5,0.08
- You knew I was busy.,- Sabía que estaba ocupado.,22.0,6.0,5.0,2.8333333333333335,0.09090909090909091,27.0,5.0,8.0,4.6,0.07407407407407407
For a football That ball was important to me,Para una pelota de fútbol Esa pelota era importante para mi,44.0,9.0,9.0,4.0,0.0,59.0,11.0,10.0,4.454545454545454,0.0
"Zhou, when many slaves may tend to be busy to take care of",Los amos están muy ocupados con las esclavas los fines de semana.,58.0,13.0,6.0,3.5384615384615383,0.017241379310344827,65.0,12.0,8.0,4.5,0.015384615384615385
Stop giving away the free money to the corporations. We wanna work! We wanna work!,¡Queremos trabajar!,82.0,15.0,13.0,4.533333333333333,0.036585365853658534,19.0,2.0,9.0,9.0,0.05263157894736842
Change it up this year.,Cambió este año.,23.0,5.0,6.0,3.8,0.043478260869565216,16.0,3.0,6.0,4.666666666666667,0.0625
"We argue that the ""constructivist transcript"" is premised on an understanding of CA as predominantly concerned with maximising its ""analytic utility"": a concern of one distinct temporal stage of CA work: that of the ""innocent"" apprehension of objects in the ""first time through"".","La importancia de esta diferencia es explorada a través del análisis de la dinámica de la práctica del AC. Argumentamos que la ""transcripción constructivista"", se basa en la premisa de una comprensión del AC como estrategia predominantemente interesada en maximizar su utilidad analítica: un interés por una etapa temporal distinta del trabajo del AC, la de la aprehensión ""inocente"" de objetos a través de su ""primer momento"".",279.0,43.0,15.0,5.511627906976744,0.03942652329749104,427.0,67.0,17.0,5.388059701492537,0.02576112412177986
You wouldn't marry me if i asked you to.,- No te casarías conmigo.,40.0,9.0,8.0,3.5555555555555554,0.05,25.0,5.0,8.0,4.2,0.08
"You don't look... you don't case, you don't do nothing.",No mira. No inspecciona. No hace nada.,55.0,10.0,8.0,4.6,0.14545454545454545,38.0,7.0,12.0,4.571428571428571,0.07894736842105263
You checked their backgrounds.,Se revisaron sus antecedentes.,30.0,4.0,12.0,6.75,0.03333333333333333,30.0,4.0,13.0,6.75,0.03333333333333333
"So you gotta chafe up your hands a little, for chrissake... like the rest of us.","Así que refriégate un poco las manos, por amor de Dios,...",80.0,16.0,12.0,4.0625,0.0625,58.0,11.0,10.0,4.363636363636363,0.08620689655172414
Yes ... exactly.,Sí. Exactamente.,16.0,3.0,8.0,4.666666666666667,0.25,16.0,2.0,12.0,7.5,0.125
What can world's religions do about climate change?,¿Qué pueden hacer las religiones del mundo con respecto al cambio climático?,51.0,8.0,9.0,5.5,0.0392156862745098,76.0,12.0,10.0,5.416666666666667,0.013157894736842105
http://www.discovernikkei.org/es/journal/2006/7/8/obon/,http://www.discovernikkei.org/es/journal/2015/8/29/my-name-is-neal/,55.0,1.0,55.0,55.0,0.21818181818181817,67.0,1.0,67.0,67.0,0.22388059701492538
"Swing by her place, see if there's anything that can help find her","Pasa a su casa, Averigua si hay algo que puede ayudarnos a encontrarla.",66.0,13.0,8.0,4.153846153846154,0.030303030303030304,71.0,13.0,12.0,4.538461538461538,0.028169014084507043
"Yeah, get it to the lab. See if we can get DNA.","Sí, llevalo al laboratorio a ver si podemos obtener el ADN.",47.0,12.0,5.0,3.0,0.06382978723404255,59.0,11.0,11.0,4.454545454545454,0.03389830508474576
It never made it to the lab.,Nunca llegó al laboratorio.,28.0,7.0,5.0,3.142857142857143,0.03571428571428571,27.0,4.0,12.0,6.0,0.037037037037037035
AARP character dining and Free Ricky Sippy Cup Day.,Cena de personajes AARP y gratis el dia de Ricky Sippy Cup.,51.0,9.0,9.0,4.777777777777778,0.0196078431372549,59.0,12.0,10.0,4.0,0.01694915254237288
"The Sun: Sunrise 05:30, Sunset 18:37.","El Sol: Salida del sol 05:20, Puesta del sol 20:20.",37.0,6.0,7.0,5.333333333333333,0.13513513513513514,51.0,10.0,6.0,4.2,0.09803921568627451
"Please, just take a few days, and think about the job, not me.","Por favor tómate unos días, y piensa en el trabajo, no en mi.",62.0,13.0,7.0,3.8461538461538463,0.06451612903225806,61.0,13.0,8.0,3.769230769230769,0.04918032786885246
- I beg to report that I'd like to welcome the Archduchess.,A sus órdenes. Me gustaría dar la bienvenida a la Archiduquesa.,59.0,12.0,12.0,4.0,0.05084745762711865,63.0,11.0,13.0,4.818181818181818,0.031746031746031744
Applicants who declare that they have been involved in such activities are liable to have their visas refused under section 501 of the Migration Act 1958 or Article 1F of the Convention in the protection visa application context.,"En virtud del artículo 501 de la Ley de Inmigración de 1958 o del artículo 1F de la Convención, se puede rechazar la solicitud de visado de los solicitantes que declaren que han participado en actividades de esa índole, en el contexto de la solicitud de visado de protección.",229.0,38.0,11.0,5.052631578947368,0.004366812227074236,275.0,49.0,12.0,4.63265306122449,0.01090909090909091
(c) 'total quantities marketed' means the quantities of spirit drinks fulfilling the terms of Articled 9 (2) of the Treaty which have been finally dispatched from production or storage facilities with a view to their sale for human consumption;,"c) « cantidades totales comercializadas »: las cantidades de bebidas espirituosas que se ajusten a las condiciones establecidas en el apartado 2 del artículo 9 del Tratado, que hayan salido definitivamente de las instalaciones de elaboración y almacenamiento con vistas a su venta para el consumo humano;",244.0,39.0,12.0,5.282051282051282,0.028688524590163935,304.0,47.0,15.0,5.48936170212766,0.013157894736842105
But he's very good at heart,Pero es muy bueno en el fondo,27.0,6.0,5.0,3.6666666666666665,0.037037037037037035,29.0,7.0,5.0,3.2857142857142856,0.0
But this one looks a little shaky.,"- Ah, aquí se nota más temblorosa.",34.0,7.0,6.0,4.0,0.029411764705882353,34.0,7.0,11.0,4.0,0.08823529411764706
"Just to show that programming can be simple and efficient, we do a program without using a programming tool!","Sólo para mostrar que la programación puede ser simple y eficiente, que hacemos un programa sin necesidad de utilizar una herramienta de programación.",108.0,19.0,11.0,4.7368421052631575,0.018518518518518517,150.0,23.0,13.0,5.565217391304348,0.013333333333333334
We have authorisation.,Tenemos permiso.,22.0,3.0,14.0,6.666666666666667,0.045454545454545456,16.0,2.0,8.0,7.5,0.0625
"I always appreciated their backing."".",Siempre estaré agradecido por su respaldo.,37.0,5.0,11.0,6.6,0.08108108108108109,42.0,6.0,10.0,6.166666666666667,0.023809523809523808
"Till Grossberger came along, he held the ax murder record in the Southwest.",Tenía el récord más alto como asesino con hacha hasta que llegó Grossberger.,75.0,13.0,11.0,4.846153846153846,0.02666666666666667,76.0,13.0,12.0,4.923076923076923,0.013157894736842105
