en,es,en_text_length,en_num_words,en_max_word_length,en_avg_word_length,en_perc_special_chars,es_text_length,es_num_words,es_max_word_length,es_avg_word_length,es_perc_special_chars
A key aspect must be the implementation of the international human rights treaties and the Commission must discuss how best to promote their full implementation by exchanging experience and sharing good practices.,"Un aspecto crucial debe ser la aplicación de los tratados internacionales de derechos humanos, y la Comisión debe examinar la mejor forma de promover su plena aplicación mediante el intercambio de experiencias y mejores prácticas.",213.0,32.0,14.0,5.6875,0.004694835680751174,230.0,35.0,15.0,5.6,0.008695652173913044
"Bearing in mind the use of non-controlled and easily substitutable chemicals in the illicit manufacture of synthetic drugs,","Teniendo en cuenta que en la fabricación ilícita de drogas sintéticas se utilizan sustancias químicas que no están sujetas a fiscalización y que pueden reemplazarse fácilmente,",123.0,18.0,14.0,5.888888888888889,0.016260162601626018,176.0,26.0,13.0,5.8076923076923075,0.005681818181818182
- Shorthouse.,- Shorthouse.,13.0,2.0,11.0,6.0,0.15384615384615385,13.0,2.0,11.0,6.0,0.15384615384615385
"Please, Lloyd, can`t we talk about this later?","Por favor, ¿no podemos hablar más tarde?",46.0,8.0,7.0,4.875,0.08695652173913043,40.0,7.0,7.0,4.857142857142857,0.05
Let’s bear in mind that parricide was punished with a lower sentence than first-degree murder in the Penal Code in effect between 1974 and 2008.,Recordemos que en el Código Penal que estuvo vigente desde 1974 hasta 2008 el parricidio se castigaba con menos penas que el homicidio doloso.,144.0,25.0,12.0,4.8,0.013888888888888888,142.0,24.0,10.0,4.958333333333333,0.007042253521126761
The color part of the flower becomes less bright amd looks more like a pencil drawing rather than a photo.,El sector de la flor que se encuentra coloreada será menos brillante y se parecerá más a un boceto a lápiz que a una fotografía.,106.0,20.0,7.0,4.35,0.009433962264150943,128.0,25.0,11.0,4.16,0.0078125
"Those who book a package on behalf of others, are required to ensure that the person / persons to participate in the package tour comply with Norwegian Holiday’s rules, and that they are registered to participate in package tour without charge to themselves or others.",Las personas que hayan hecho la reserva de un paquete en nombre de otros se tienen que asegurar de que la persona o personas que participarán en el paquete turístico cumplan la normativa de Norwegian Holidays y de que estén inscritas para participar en el paquete turístico sin habérselo cargado a ellos mismos o a otros.,268.0,45.0,11.0,4.977777777777778,0.014925373134328358,321.0,56.0,12.0,4.75,0.003115264797507788
Father saw Laputa in the Dragon's Nest!,Mi Padre vió Laputa en el Nido del Dragón!,39.0,7.0,8.0,4.714285714285714,0.05128205128205128,42.0,9.0,7.0,3.7777777777777777,0.023809523809523808
Next,Siguiente,4.0,1.0,4.0,4.0,0.0,9.0,1.0,9.0,9.0,0.0
It has juggled ceaselessly to keep everything in balance.,Se ha malabarismos sin cesar para mantener todo en equilibrio.,57.0,9.0,11.0,5.444444444444445,0.017543859649122806,62.0,10.0,12.0,5.3,0.016129032258064516
He sent this instead.,Me dijo que les trajera esto.,21.0,4.0,8.0,4.5,0.047619047619047616,29.0,6.0,7.0,4.0,0.034482758620689655
This says it was a beer jug.,Esto dice que era un jarro de cerveza.,28.0,7.0,4.0,3.142857142857143,0.03571428571428571,38.0,8.0,8.0,3.875,0.02631578947368421
"- Ladies, are we really that cynical?","- Chicas, en serio somos tan cinicas?",37.0,7.0,8.0,4.428571428571429,0.08108108108108109,37.0,7.0,8.0,4.428571428571429,0.08108108108108109
I've seen them on you.,Estarás listo cuando las veas en todos.,22.0,5.0,4.0,3.6,0.09090909090909091,39.0,7.0,7.0,4.714285714285714,0.02564102564102564
"Nah, I hadn't really thought about it.","No, no pensé en ello.",38.0,7.0,7.0,4.571428571428571,0.07894736842105263,21.0,5.0,5.0,3.4,0.09523809523809523
Subprogramme 2 Information services,Subprograma 2 Servicios de información,35.0,4.0,12.0,8.0,0.0,38.0,5.0,11.0,6.8,0.0
"- I know, ma.",- Siento que tenga que trabajar tanto.,13.0,4.0,5.0,2.5,0.23076923076923078,38.0,7.0,8.0,4.571428571428571,0.05263157894736842
"Wheeler, take the bogies left and around.","Wheeler, los blindados, por la izquierda.",41.0,7.0,8.0,5.0,0.04878048780487805,41.0,6.0,10.0,6.0,0.07317073170731707
The Board of Auditors also raised this issue in its report on the accounts of the Fund for the biennium ended 31 December 2001.4,La Junta de Auditores también planteó esta cuestión en su informe sobre las cuentas de la Caja para el bienio terminado el 31 de diciembre de 2001.,128.0,24.0,8.0,4.375,0.0078125,147.0,27.0,9.0,4.481481481481482,0.006802721088435374
- Just behave yourself.,- Comportate.,23.0,4.0,9.0,5.0,0.08695652173913043,13.0,2.0,11.0,6.0,0.15384615384615385
Like warn his potential victims.,Como avisar a sus víctimas potenciales. Lo estás haciendo bien.,32.0,5.0,9.0,5.6,0.03125,63.0,10.0,12.0,5.4,0.031746031746031744
- Will you marry me? - No. - Can I ask you a favour?,-¿Puedo pedirte un favor?,52.0,14.0,7.0,2.7857142857142856,0.11538461538461539,25.0,4.0,7.0,5.5,0.08
"As regards the distinction between the freedom of establishment and the free movement of services, according to the case law of the Court of Justice the key element is whether or not the operator is established in the Member State where it provides the service concerned.","En lo referente a la distinción entre la libertad de establecimiento y la libre circulación de servicios, el elemento clave, de acuerdo con la jurisprudencia del Tribunal de Justicia, es si el agente está o no establecido en el Estado miembro en que presta el servicio de que se trate.",271.0,46.0,13.0,4.913043478260869,0.007380073800738007,285.0,50.0,15.0,4.72,0.014035087719298246
"What can we do for you, sir?","¿En qué podemos ayudarle, señor?",28.0,7.0,4.0,3.142857142857143,0.07142857142857142,32.0,5.0,9.0,5.6,0.0625
Sea-ice extent - Chapter 2.2.5.,Extensión del hielo marino . Capítulo 2.2.5.,31.0,5.0,7.0,5.4,0.16129032258064516,44.0,7.0,9.0,5.428571428571429,0.09090909090909091
"- What a talented father, Maja.","- ¡Qué padre talentoso tienes, Maja!",31.0,6.0,8.0,4.333333333333333,0.0967741935483871,36.0,6.0,9.0,5.166666666666667,0.08333333333333333
"OJ L 125, 28.4.2004, p. 61 and OJ L 323, 26.10.2004, p. 17.","DO L 125 de 28.4.2004, p. 61. Posición Común modificada por la Posición Común 2004/730/PESC (DO L 323 de 26.10.2004, p. 17).",59.0,13.0,11.0,3.6153846153846154,0.1864406779661017,124.0,22.0,13.0,4.681818181818182,0.11290322580645161
Do you know also why he left me?,¿Sabe por qué me dejó?,32.0,8.0,4.0,3.125,0.03125,22.0,5.0,5.0,3.6,0.045454545454545456
We really didn't come over to throw our happiness in your face.,¿Te acuerdas de ese incidente... con material inflamable en el césped?,63.0,12.0,9.0,4.333333333333333,0.031746031746031744,70.0,11.0,12.0,5.454545454545454,0.05714285714285714
"Well, it's all in code on the computer. Let's see. He goes: ""Eh, that would be militairy grade plastic explosives"".","Él va al ordenador ver lo que es... verifica y me dice ""Parece ser un explosivo plástico de categoría militar"".",115.0,20.0,12.0,4.8,0.08695652173913043,111.0,20.0,9.0,4.6,0.05405405405405406
Greenwich Village and the West Village is a favorite location for people coming to New York. Demand for rooms to rent is especially high in Greenwich Village and the West Village due to the area universities and the limited inventory of rooms in the neighborhood.,La demanda de habitaciones en alquiler es especialmente alta en Greenwich Village y West Village debido al área de universidades y a la cantidad limitada de habitaciones en el vecindario.,263.0,45.0,13.0,4.866666666666666,0.0076045627376425855,187.0,30.0,13.0,5.266666666666667,0.0053475935828877
And let her know it was MacLeod's decision.,Y hazle saber que fue decisión de MacLeod.,43.0,8.0,9.0,4.5,0.046511627906976744,42.0,8.0,8.0,4.375,0.023809523809523808
"Watson, Brother Mycroft.","Watson, mi hermano Mycroft.",24.0,3.0,8.0,7.333333333333333,0.08333333333333333,27.0,4.0,8.0,6.0,0.07407407407407407
Way over on the wet side,En el lado húmedo,24.0,6.0,4.0,3.1666666666666665,0.0,17.0,4.0,6.0,3.5,0.0
provisional agenda and annotations*,Programa provisional del noveno período de sesiones de la Comisión.,35.0,4.0,12.0,8.0,0.02857142857142857,67.0,10.0,11.0,5.8,0.014925373134328358
"Mark's kinda right, you know.","Mark tiene algo de razón, ¿sabes?",29.0,5.0,6.0,5.0,0.10344827586206896,33.0,6.0,7.0,4.666666666666667,0.06060606060606061
"Well, if he wasn't, I think you'd be the first to know.","Si no lo estuviera, serías el primero en saberlo.",55.0,12.0,7.0,3.6666666666666665,0.09090909090909091,49.0,9.0,10.0,4.555555555555555,0.04081632653061224
I felt you stir... the moment you took your first breath.,"Senti que volviste, desde le momento que diste tu primer suspiro.",57.0,11.0,7.0,4.2727272727272725,0.07017543859649122,65.0,11.0,9.0,5.0,0.03076923076923077
They were rewarded: the usually reluctant Jewish-owned American press published their letters and articles.,"Recibieron el merecido premio: la prensa norteamericana, cuyos dueños son judíos, publicó sus cartas y artículos en contraste con sus reticencias habituales.",107.0,14.0,12.0,6.714285714285714,0.028037383177570093,157.0,22.0,15.0,6.181818181818182,0.025477707006369428
"Yes, Nurse, what about him?","Sí, enfermera, ¿qué pasa con él?",27.0,5.0,6.0,4.6,0.1111111111111111,32.0,6.0,10.0,4.5,0.09375
"In my opinion, it would offer no advantages but, instead, be confusing.","En mi opinión, ello no ofrecería ventajas sino que, al contrario, sería confuso.",71.0,12.0,10.0,5.0,0.056338028169014086,80.0,13.0,10.0,5.230769230769231,0.05
"There's so much evil, so much...bad blood.","Hay tanta maldad, tanta... mala sangre.",42.0,7.0,10.0,5.142857142857143,0.14285714285714285,39.0,6.0,8.0,5.666666666666667,0.1282051282051282
Paint chips.,Patatas fritas.,12.0,2.0,6.0,5.5,0.08333333333333333,15.0,2.0,7.0,7.0,0.06666666666666667
Non-humanitarian aid or development programmes shall be suspended.,Los programas que no sean de ayuda humanitaria ni de desarrollo serán suspendidos.,66.0,8.0,16.0,7.375,0.030303030303030304,82.0,13.0,12.0,5.384615384615385,0.012195121951219513
It's because I feel like if I don't hold everything together--,Es porque siento que si no mantengo todo en orden ...,62.0,11.0,10.0,4.7272727272727275,0.06451612903225806,53.0,11.0,8.0,3.909090909090909,0.05660377358490566
"You are wrong, father.","Ud. Esta equivocado, Padre.",22.0,4.0,7.0,4.75,0.09090909090909091,27.0,4.0,11.0,6.0,0.1111111111111111
"WE'LL BE GRINNIN', SPINNIN'","Estaremos riendo, dando vueltas.",27.0,4.0,9.0,6.0,0.14814814814814814,32.0,4.0,9.0,7.25,0.0625
"This is a winning solution for both Kern and Laurenti. As a result of this cooperation, Kern will be able to sell its products even more successfully throughout South America and to offer its customers technical support.","Esta aparcería representa una grande oportunidad para Kern y Laurenti. Como resultado de esta cooperación, Kern podrá ampliar su participación en el mercado brasilero y sudamericano, incluso ofreciendo mejor soporte técnico y comercial a sus clientes.",220.0,37.0,12.0,4.972972972972973,0.013636363636363636,251.0,36.0,13.0,6.0,0.01593625498007968
"In February 2007, the Codification Division launched a new website dedicated to Reports of International Arbitral Awards, following the completion of the digitization of all 25 volumes (www.un.org/law/riaa/).","En febrero de 2007, la División de Codificación inauguró un sitio web dedicado a los Informes de laudos arbitrales internacionales, tras haberse digitalizado todos los 25 volúmenes (www.un.org/law/riaa/).",208.0,28.0,23.0,6.464285714285714,0.04807692307692308,204.0,28.0,23.0,6.321428571428571,0.049019607843137254
"If you mean an escape route, I ran into nothing but solid walls.",Nada más que muros de roca sólida.,64.0,13.0,7.0,4.0,0.03125,34.0,7.0,7.0,4.0,0.029411764705882353
"If I want to show my purse, I will not do it like that.","Si quiero enseñar mi bolso, no lo haré así.",55.0,14.0,6.0,3.0,0.03636363636363636,43.0,9.0,7.0,3.888888888888889,0.046511627906976744
"Bet you wish you gave me that key now. ♪ Men, men, manly men, men, men ♪ ♪ Ooh.",Apuesto a que desearías haberme dado llaves.,79.0,19.0,5.0,3.210526315789474,0.0759493670886076,44.0,7.0,9.0,5.428571428571429,0.022727272727272728
"There is something at work here, and it all began with the man killed in the car crash- - Bob Harvey.","Hay algo trabajando detrás de esto, y todo se inició con el hombre que murió en el accidente automovilístico-",101.0,21.0,9.0,3.857142857142857,0.039603960396039604,109.0,19.0,16.0,4.7894736842105265,0.01834862385321101
When a skunk needs killing... it ain't enough just to say a skunk's a skunk.,Cuando hay que matar a un canalla no basta con decir que un canalla es un canalla.,76.0,15.0,10.0,4.133333333333334,0.07894736842105263,82.0,17.0,8.0,3.8823529411764706,0.012195121951219513
"- (PT) I would like to express my support for the new fisheries protocol concluded between the European Community and Mauritania for the period 1 August 2001 to 31 July 2006, which I deem of vital importance to the European Community, not only because of the fishing opportunities it offers and the sums involved, but mainly for socio-economic reasons, since it enables a large number of vessels operating in Moroccan waters to move to new fishing grounds.","Quisiera expresar mi acuerdo con el nuevo Protocolo de Pesca celebrado entre la Comunidad Europea y Mauritania para el período comprendido entre el 1 de agosto de 2001 y el 31 de julio de 2006, que considero de vital importancia para la Comunidad Europea, no sólo por las posibilidades de pesca que ofrece y por el importe financiero que entraña, sino también, y principalmente, por motivos de naturaleza socioeconómica, al permitir el traslado a nuevas pesquerías de un importante número de embarcaciones que faenaban en las aguas marroquíes.",456.0,77.0,14.0,4.935064935064935,0.019736842105263157,543.0,88.0,15.0,5.181818181818182,0.01289134438305709
"The Supreme Court, as well as the Courts of Appeal and Courts of First Instance exercise the judicial power.","El ejercicio del poder judicial corresponde al Tribunal Supremo, los tribunales de apelación y los tribunales de primera instancia.",108.0,19.0,8.0,4.7368421052631575,0.018518518518518517,131.0,19.0,11.0,5.947368421052632,0.015267175572519083
- I hope you enjoy your stay.,- Espero que disfruten de su estancia.,29.0,7.0,5.0,3.2857142857142856,0.06896551724137931,38.0,7.0,9.0,4.571428571428571,0.05263157894736842
- We will drag you as well.,- Te arrastraremos a ti también. - ¡No!,27.0,7.0,5.0,3.0,0.07407407407407407,39.0,8.0,13.0,4.0,0.10256410256410256
"I'm not to wait on ladies, am I?",- ¿Tendré que ocuparme de las señoras?,32.0,8.0,7.0,3.125,0.09375,38.0,7.0,8.0,4.571428571428571,0.05263157894736842
We need to keep moving or we'll never get it started again.,Debemos seguir moviéndonos o no podremos volver a arrancar.,59.0,12.0,7.0,4.0,0.03389830508474576,59.0,9.0,11.0,5.666666666666667,0.01694915254237288
It is a clumsy and stupid guy with big ears and a bad haircut.,Es un chico torpe y estúpido con orejas grandes y un mal corte de pelo.,62.0,14.0,8.0,3.5,0.016129032258064516,71.0,15.0,8.0,3.8,0.014084507042253521
You can follow her upstairs.,Puedes seguirla arriba.,28.0,5.0,9.0,4.8,0.03571428571428571,23.0,3.0,8.0,7.0,0.043478260869565216
Don't use it at all.,No la uso nunca.,20.0,5.0,5.0,3.2,0.1,16.0,4.0,6.0,3.25,0.0625
I think we should consider ECMO.,Podríamos probar con un ECMO.,32.0,6.0,8.0,4.5,0.03125,29.0,5.0,9.0,5.0,0.034482758620689655
"Big kiss, Rapha.","Un besazo, Rapha.",16.0,3.0,6.0,4.666666666666667,0.125,17.0,3.0,7.0,5.0,0.11764705882352941
"His delegation had hoped that explicit priority would be given to the withdrawal from the Bakassi Peninsula in 2006, and had been disappointed by the answers given by the Secretariat in that regard during the Committee's informal consultations.","El Camerún esperaba que se concediera una prioridad explícita a la retirada de la península de Bakassi en 2006, pero le parecieron decepcionantes las respuestas dadas al respecto por la Secretaría durante las consultas oficiosas de la Comisión.",244.0,38.0,14.0,5.447368421052632,0.012295081967213115,244.0,38.0,14.0,5.447368421052632,0.00819672131147541
"Dr. Larson, President says, “I am very pleased with the appointment of Mr. Rojas to our board of directors.","John Larson, CEO de TC Power dijo, “Estoy muy complacido con la designación de Nivaldo Rojas en nuestro directorio.",107.0,19.0,11.0,4.684210526315789,0.04672897196261682,115.0,19.0,11.0,5.105263157894737,0.02608695652173913
"He went away, all right?","Él se fue, ¿entiendes?",24.0,5.0,6.0,4.0,0.08333333333333333,22.0,4.0,11.0,4.75,0.09090909090909091
The Continuum of Feelings;,El Continuum de los Sentimientos;,26.0,4.0,9.0,5.75,0.038461538461538464,33.0,5.0,13.0,5.8,0.030303030303030304
"This new Commission must be seen to be acting decisively and if public confidence is not to be eroded we need action within days, not within weeks or months.","Esta nueva Comisión debe actuar con firmeza y, si no se quiere que la confianza pública se desmorone, lo que necesitamos es que se actúe dentro de pocos días y no dentro de semanas o de meses.",157.0,29.0,10.0,4.448275862068965,0.012738853503184714,192.0,37.0,11.0,4.216216216216216,0.015625
"Jerry, we already set a price.","Jerry, ya hemos establecido un precio.",30.0,6.0,7.0,4.166666666666667,0.06666666666666667,38.0,6.0,11.0,5.5,0.05263157894736842
"Before considering using VAST, you should verify that your ad server supports it.","Antes de plantearse utilizar VAST, debería verificar que es compatible con su servidor de anuncios.",81.0,13.0,11.0,5.3076923076923075,0.024691358024691357,99.0,15.0,10.0,5.666666666666667,0.020202020202020204
We only became in love after she left.,Nos enamoramos cuando ya se había ido.,38.0,8.0,6.0,3.875,0.02631578947368421,38.0,7.0,10.0,4.571428571428571,0.02631578947368421
What are you doin?,¿Qué haces?,18.0,4.0,5.0,3.75,0.05555555555555555,11.0,2.0,6.0,5.0,0.09090909090909091
"Then Peter said unto them, Repent, and be baptized every one of you in the name of Jesus Christ for the remission of sins and ye shall receive the gift ofthe Holy Ghost. (Acts 2:38)","Y Pedro les dice: Arrepentios, y bautícese cada uno de vosotros en el nombre de Jesucristo para perdón de los pecados; y recibiréis el don del Espíritu Santo. (Hechos 2:37-38).",181.0,35.0,9.0,4.2,0.03314917127071823,176.0,30.0,12.0,4.9,0.05113636363636364
"The Commission is committed to help, but ultimately the key to better transnational mobility of cultural players lies in the hands of the Member States.","La Comisión se ha comprometido a cooperar pero, en última instancia, la clave para mejorar la movilidad transnacional de los profesionales del sector cultural está en manos de los Estados miembros.",152.0,25.0,13.0,5.12,0.013157894736842105,197.0,31.0,13.0,5.387096774193548,0.015228426395939087
"Everybody, bye-bye to the mayor.","Todos, diganle adiós al mayor. Adiós.",32.0,5.0,10.0,5.6,0.09375,37.0,6.0,7.0,5.333333333333333,0.08108108108108109
The girl's who's been driving my baby to school.,La chica que ha estado llevando a mi niña al instituto.,48.0,9.0,7.0,4.444444444444445,0.0625,55.0,11.0,10.0,4.090909090909091,0.01818181818181818
"Around the world, people worry that political freedom isdisappearing in Vladimir Putin's Russia.",En todo el mundo hay preocupación por que la libertadpolítica esté desapareciendo en la Rusia de VladimirPutin.,96.0,13.0,14.0,6.461538461538462,0.03125,111.0,17.0,16.0,5.588235294117647,0.009009009009009009
- stay around for a spell?,- quedarnos un tiempo?,26.0,6.0,6.0,3.5,0.07692307692307693,22.0,4.0,9.0,4.75,0.09090909090909091
That I know would loveto work with you.,que sé que les encantará trabajar contigo.,39.0,8.0,6.0,4.0,0.02564102564102564,42.0,7.0,9.0,5.142857142857143,0.023809523809523808
We take a short cut around a bend to get back on the road some ten metres on.,"Atajaremos una curva para retomar la carretera una decena de metros más adelante que nos dirige a La Degollada, tradicional asentamiento prehispánico situado al pie de la Montaña de Guía.",77.0,18.0,6.0,3.3333333333333335,0.012987012987012988,187.0,30.0,12.0,5.266666666666667,0.0106951871657754
Then they got into a fight.,Pero se pelearon.,27.0,6.0,6.0,3.6666666666666665,0.037037037037037035,17.0,3.0,9.0,5.0,0.058823529411764705
"What we really need is someone who's clean, will do the deed clean.","Lo que necesitamos realmente, es alguien limpio... que haga las cosas claras.",67.0,13.0,7.0,4.230769230769231,0.04477611940298507,77.0,12.0,11.0,5.5,0.06493506493506493
The Act in question was amended on 23 July 2003 to give creators of literary and artistic works broader protection than they had previously enjoyed.,"Es así que con fecha 23 de julio de 2003 se reformó la ley en comento, con el fin de proporcionar a los creadores de obras literarias y artísticas una protección más amplia de la que gozaban.",148.0,25.0,10.0,4.96,0.006756756756756757,191.0,37.0,12.0,4.1891891891891895,0.010471204188481676
"He says, whoever talks will be swallowed up by the evil spirits of the rapids.",Que quien hable será engullido por los espíritus malignos del remolino.,78.0,15.0,9.0,4.266666666666667,0.02564102564102564,71.0,11.0,9.0,5.545454545454546,0.014084507042253521
"If we let it make, if we keep this only tree, all the forest will die.","Si lo dejamos seguir adelante, si conservamos sólo este árbol",70.0,16.0,6.0,3.4375,0.04285714285714286,61.0,10.0,11.0,5.2,0.01639344262295082
It's your line.,- Fräulein...,15.0,3.0,5.0,4.333333333333333,0.13333333333333333,13.0,2.0,11.0,6.0,0.3076923076923077
The Office of the Attorney-General also ran a programme from 24 to 27 October 2002 in Mexico City on the effective investigation and documentation of the offence of torture.,"Asimismo, la Procuraduría General de la República llevó a cabo del 24 al 27 de octubre de 2002, en la Ciudad de México, el ""Programa de Entrenamiento para la Efectiva Investigación y Documentación del Delito de Tortura"".",173.0,29.0,16.0,5.0,0.011560693641618497,220.0,37.0,13.0,4.972972972972973,0.02727272727272727
"absence by reason of holidays, military service, sickness, accident or death;","ausencia del trabajo por vacaciones, servicio militar, enfermedad, accidente, fallecimiento, etc.;",77.0,11.0,9.0,6.090909090909091,0.05194805194805195,98.0,11.0,14.0,8.0,0.07142857142857142
"During all of the successive sessions of the General Assembly since 1993, the General Committee has flatly refused to include in the agenda of the General Assembly the issue of the so-called Taiwan's “participation” in the United Nations.","Durante todos los períodos de sesiones sucesivos de la Asamblea General celebrados desde 1993, la Mesa se ha negado rotundamente a incluir en el programa de la Asamblea General la cuestión de la denominada “participación” de Taiwán en las Naciones Unidas.",238.0,38.0,15.0,5.2894736842105265,0.01680672268907563,255.0,41.0,15.0,5.2439024390243905,0.00784313725490196
I need more time to check files.,Necesito más tiempo para revisar los archivos.,32.0,7.0,6.0,3.7142857142857144,0.03125,46.0,7.0,9.0,5.714285714285714,0.021739130434782608
"Woman, I have fought 177 men.","Mujer, he luchado con 177 hombres.",29.0,6.0,6.0,4.0,0.06896551724137931,34.0,6.0,8.0,4.833333333333333,0.058823529411764705
"b. The right to bank loans, mortgages and other forms of financial credits","b) El derecho a obtener préstamos bancarios, hipotecas y otras formas de crédito financiero.",74.0,13.0,9.0,4.769230769230769,0.02702702702702703,92.0,14.0,11.0,5.642857142857143,0.03260869565217391
- And those scratches?,- ¿ Y los raspones?,22.0,4.0,10.0,4.75,0.09090909090909091,19.0,5.0,9.0,3.0,0.10526315789473684
Of a stage conquered and a throne lost.,¡De un escenario conquistado y un trono perdido!,39.0,8.0,9.0,4.0,0.02564102564102564,48.0,8.0,11.0,5.125,0.020833333333333332
"This, where my finger is... Uh-huh. That's how far the knife went inside his chest.","Aquí, donde está mi dedo, eso es cuánto penetró el cuchillo en el pecho.",83.0,15.0,7.0,4.6,0.0963855421686747,72.0,14.0,8.0,4.214285714285714,0.041666666666666664
"And open, please.","Abra la boca, por favor.",17.0,3.0,7.0,5.0,0.11764705882352941,24.0,5.0,6.0,4.0,0.08333333333333333
No. Ready?,No. ¿Listo?,10.0,2.0,6.0,4.5,0.2,11.0,2.0,7.0,5.0,0.18181818181818182
I'll be a model school!,Voy a ser una escuela modelo !,23.0,5.0,7.0,3.8,0.08695652173913043,30.0,7.0,7.0,3.4285714285714284,0.03333333333333333
"Their hull's intact, but there's significant damage to their engines and power systems.","Su casco está intacto, pero hay daños significativos en sus motores y sistemas de energía",87.0,13.0,11.0,5.769230769230769,0.04597701149425287,89.0,15.0,14.0,5.0,0.011235955056179775
"Beck, don't!","¡Beck, no!",12.0,2.0,6.0,5.5,0.25,10.0,2.0,6.0,4.5,0.2
Says it was self-defence.,Dijo que fue en defensa propia.,25.0,4.0,13.0,5.5,0.08,31.0,6.0,7.0,4.333333333333333,0.03225806451612903
== History ==The area of today's Praga-Południe has been inhabited since at least the 7th century.,"== Historia ==La zona de ""Praga-Południe"" ha estado habitada desde el siglo VII.",98.0,16.0,14.0,5.1875,0.07142857142857142,80.0,13.0,16.0,5.230769230769231,0.1
"I have a back pain, as is.",De todos modos me duele la espalda.,26.0,7.0,5.0,2.857142857142857,0.07692307692307693,35.0,7.0,8.0,4.142857142857143,0.02857142857142857
